{
  "evidence_state": "SYNTHETIC_CONTRACT_ONLY",
  "fields": [
    {
      "authority_class": "IDENTITY",
      "display_precision": null,
      "missing_policy": "REQUIRED_BLOCK",
      "output_field": "run.run_id",
      "rounding_mode": null,
      "scale": null,
      "source_artifact_id": "producer.run_manifest.v1",
      "source_json_pointer": "/run_id",
      "source_schema_version": "qme.synthetic.ui_source.v1",
      "transform": "COPY",
      "transform_version": "qme.ui.copy.v1",
      "unit": null
    },
    {
      "authority_class": "PROVENANCE",
      "display_precision": null,
      "missing_policy": "REQUIRED_BLOCK",
      "output_field": "run.analysis_as_of",
      "rounding_mode": null,
      "scale": null,
      "source_artifact_id": "producer.run_manifest.v1",
      "source_json_pointer": "/analysis_as_of",
      "source_schema_version": "qme.synthetic.ui_source.v1",
      "transform": "COPY",
      "transform_version": "qme.ui.copy.v1",
      "unit": null
    },
    {
      "authority_class": "IDENTITY",
      "display_precision": null,
      "missing_policy": "REQUIRED_BLOCK",
      "output_field": "run.membership_snapshot_id",
      "rounding_mode": null,
      "scale": null,
      "source_artifact_id": "producer.run_manifest.v1",
      "source_json_pointer": "/membership_snapshot_id",
      "source_schema_version": "qme.synthetic.ui_source.v1",
      "transform": "COPY",
      "transform_version": "qme.ui.copy.v1",
      "unit": null
    },
    {
      "authority_class": "PROVENANCE",
      "display_precision": null,
      "missing_policy": "REQUIRED_BLOCK",
      "output_field": "run.membership_hash",
      "rounding_mode": null,
      "scale": null,
      "source_artifact_id": "producer.run_manifest.v1",
      "source_json_pointer": "/membership_hash",
      "source_schema_version": "qme.synthetic.ui_source.v1",
      "transform": "COPY",
      "transform_version": "qme.ui.copy.v1",
      "unit": null
    },
    {
      "authority_class": "QUANTITATIVE",
      "display_precision": null,
      "missing_policy": "REQUIRED_BLOCK",
      "output_field": "run.membership_count",
      "rounding_mode": null,
      "scale": null,
      "source_artifact_id": "producer.run_manifest.v1",
      "source_json_pointer": "/membership_count",
      "source_schema_version": "qme.synthetic.ui_source.v1",
      "transform": "COPY",
      "transform_version": "qme.ui.copy.v1",
      "unit": null
    },
    {
      "authority_class": "STATUS",
      "display_precision": null,
      "missing_policy": "REQUIRED_BLOCK",
      "output_field": "run.run_status",
      "rounding_mode": null,
      "scale": null,
      "source_artifact_id": "producer.run_manifest.v1",
      "source_json_pointer": "/run_status",
      "source_schema_version": "qme.synthetic.ui_source.v1",
      "transform": "COPY",
      "transform_version": "qme.ui.copy.v1",
      "unit": null
    },
    {
      "authority_class": "STATUS",
      "display_precision": null,
      "missing_policy": "REQUIRED_BLOCK",
      "output_field": "run.completeness_status",
      "rounding_mode": null,
      "scale": null,
      "source_artifact_id": "producer.run_manifest.v1",
      "source_json_pointer": "/completeness_status",
      "source_schema_version": "qme.synthetic.ui_source.v1",
      "transform": "COPY",
      "transform_version": "qme.ui.copy.v1",
      "unit": null
    },
    {
      "authority_class": "IDENTITY",
      "display_precision": null,
      "missing_policy": "REQUIRED_BLOCK",
      "output_field": "universe[].security_id",
      "rounding_mode": null,
      "scale": null,
      "source_artifact_id": "producer.universe_scores.v1",
      "source_json_pointer": "/rows/*/security_id",
      "source_schema_version": "qme.synthetic.ui_source.v1",
      "transform": "COPY",
      "transform_version": "qme.ui.copy.v1",
      "unit": null
    },
    {
      "authority_class": "IDENTITY",
      "display_precision": null,
      "missing_policy": "REQUIRED_BLOCK",
      "output_field": "universe[].ticker",
      "rounding_mode": null,
      "scale": null,
      "source_artifact_id": "producer.universe_scores.v1",
      "source_json_pointer": "/rows/*/ticker",
      "source_schema_version": "qme.synthetic.ui_source.v1",
      "transform": "COPY",
      "transform_version": "qme.ui.copy.v1",
      "unit": null
    },
    {
      "authority_class": "IDENTITY",
      "display_precision": null,
      "missing_policy": "REQUIRED_BLOCK",
      "output_field": "universe[].company_name",
      "rounding_mode": null,
      "scale": null,
      "source_artifact_id": "producer.universe_scores.v1",
      "source_json_pointer": "/rows/*/company_name",
      "source_schema_version": "qme.synthetic.ui_source.v1",
      "transform": "COPY",
      "transform_version": "qme.ui.copy.v1",
      "unit": null
    },
    {
      "authority_class": "STATUS",
      "display_precision": null,
      "missing_policy": "REQUIRED_BLOCK",
      "output_field": "universe[].data_status",
      "rounding_mode": null,
      "scale": null,
      "source_artifact_id": "producer.universe_scores.v1",
      "source_json_pointer": "/rows/*/data_status",
      "source_schema_version": "qme.synthetic.ui_source.v1",
      "transform": "COPY",
      "transform_version": "qme.ui.copy.v1",
      "unit": null
    },
    {
      "authority_class": "QUANTITATIVE",
      "display_precision": 0,
      "missing_policy": "PRESERVE_EXPLICIT",
      "output_field": "universe[].rank",
      "rounding_mode": "ROUND_HALF_EVEN",
      "scale": "1",
      "source_artifact_id": "producer.universe_scores.v1",
      "source_json_pointer": "/rows/*/rank",
      "source_schema_version": "qme.synthetic.ui_source.v1",
      "transform": "FORMAT_DECIMAL",
      "transform_version": "qme.ui.format_decimal.v1",
      "unit": "RANK"
    },
    {
      "authority_class": "PRESENTATION",
      "display_precision": null,
      "missing_policy": "PRESERVE_EXPLICIT",
      "output_field": "universe[].rank.sort_key",
      "rounding_mode": null,
      "scale": null,
      "source_artifact_id": "producer.universe_scores.v1",
      "source_json_pointer": "/rows/*/rank",
      "source_schema_version": "qme.synthetic.ui_source.v1",
      "transform": "MAKE_SORT_KEY",
      "transform_version": "qme.ui.sort_key.v1",
      "unit": null
    },
    {
      "authority_class": "QUANTITATIVE",
      "display_precision": 2,
      "missing_policy": "PRESERVE_EXPLICIT",
      "output_field": "universe[].momentum_12_1",
      "rounding_mode": "ROUND_HALF_EVEN",
      "scale": "100",
      "source_artifact_id": "producer.universe_scores.v1",
      "source_json_pointer": "/rows/*/momentum_12_1",
      "source_schema_version": "qme.synthetic.ui_source.v1",
      "transform": "FORMAT_DECIMAL",
      "transform_version": "qme.ui.format_decimal.v1",
      "unit": "PERCENT"
    },
    {
      "authority_class": "PRESENTATION",
      "display_precision": null,
      "missing_policy": "PRESERVE_EXPLICIT",
      "output_field": "universe[].momentum_12_1.sort_key",
      "rounding_mode": null,
      "scale": null,
      "source_artifact_id": "producer.universe_scores.v1",
      "source_json_pointer": "/rows/*/momentum_12_1",
      "source_schema_version": "qme.synthetic.ui_source.v1",
      "transform": "MAKE_SORT_KEY",
      "transform_version": "qme.ui.sort_key.v1",
      "unit": null
    },
    {
      "authority_class": "STATUS",
      "display_precision": null,
      "missing_policy": "REQUIRED_BLOCK",
      "output_field": "universe[].selected",
      "rounding_mode": null,
      "scale": null,
      "source_artifact_id": "producer.universe_scores.v1",
      "source_json_pointer": "/rows/*/selected",
      "source_schema_version": "qme.synthetic.ui_source.v1",
      "transform": "COPY",
      "transform_version": "qme.ui.copy.v1",
      "unit": null
    },
    {
      "authority_class": "STATUS",
      "display_precision": null,
      "missing_policy": "PRESERVE_EXPLICIT",
      "output_field": "universe[].review_reasons",
      "rounding_mode": null,
      "scale": null,
      "source_artifact_id": "producer.universe_scores.v1",
      "source_json_pointer": "/rows/*/review_reasons",
      "source_schema_version": "qme.synthetic.ui_source.v1",
      "transform": "COPY",
      "transform_version": "qme.ui.copy.v1",
      "unit": null
    },
    {
      "authority_class": "PROVENANCE",
      "display_precision": null,
      "missing_policy": "REQUIRED_BLOCK",
      "output_field": "universe[].row_hash",
      "rounding_mode": null,
      "scale": null,
      "source_artifact_id": "producer.universe_scores.v1",
      "source_json_pointer": "/rows/*/row_hash",
      "source_schema_version": "qme.synthetic.ui_source.v1",
      "transform": "COPY",
      "transform_version": "qme.ui.copy.v1",
      "unit": null
    }
  ],
  "map_id": "NEE-169-STAGE0-FIELD-MAP-V1",
  "schema_version": "qme.ui.field_map.v1"
}
